"649","2018-04-11 00:16:00","5","es","2018-04-10 22:44:52","2018-04-11 00:16:00","85.219.116.192","","Femenino","61","Española","Universitario graduado","4. Bueno","Sí","No","Miopia","5. Varias veces al día","4. 2-4 horas","No","Sí","No","No","No","Paginas de internet","3. Ni muchas ni pocas","4. Tableta","4. A diario","No","Sí","No","","4. Dos o tres veces por semana","2. Alguna vez","2","Sí","4. Bastantes veces","4. Bastantes veces","3. En ocasiones","3. A veces envío imágenes que hago yo y otras veces no, la proporción es equilibrada","Sí","1. No soy fan de nadie a quien admire","3. En ocasiones","3. En ocasiones","3. En ocasiones","5. Casi siempre o siempre","2. Accedo a la información propuesta","1. Busco imágenes para ilustrar lo que estoy diciendo.","1. Busco en Google Imágenes. No tengo en cuenta la licencia de la imagen que utilizo","","","4. Dos o tres veces por semana","No","No","No","No","Sí","","No","No","No","No","No","No","","No","Sí","No","No","","1. Nada importante","Sí","Sí","No","No","No","","4. Bastantes veces","3. Por igual de medios digitales y analógicos","","Una mujer tumbada en una playa rocosa","Una persona de pie de espaldas y otra detrás sentada, a la que se le ven las piernas entre las de la persona que esta de pie","Una pareja a caballo en una feria , al caballo solo se le ven dos patas","Unas patas delanteras de un animal , unas botas de una persona con abrigo ,un perro pequeño , con abrigo y gorro","Dos gallos de pelea","Un brazo con mano en blanco y una cara en negro","Unas hojas y una flor con forma de labios","Tres capas , o tres monjas de espaldas","Un buceador y peces","Una pareja, pero al hombre le falta medio cuerpo","Un señor lanzando sandías , en un mercado","No","Los reflejos en el agua","La sensación de movimiento y la larga trenza","La quietud de los personajes y la sensación del cielo , parece que va a estallar una tormenta","La importancia de la acción que desarrolla el portador del martillo","La sombra de la persona del balcón ","Un árabe en una mezquita","Un pescador con un gran pez","Una persona mirando un plano  detrás de una cortins","Un arreglo en un muro","Un hombre sentado en el pie de una gran estatua","Muchas cabezas búfalos","1/2","2/2","2/2","2/2","Un camino entre arboles","Una calle","La fachada de un colegio o de un gran edificio","Un rio","No","Sí","Sí","La primera y la tercera para mi tienen significado , la segunda no","Retrata un instante de la vida cotidiana , ","Refleja una tradición   , como la anterior es un instante de vida","No  demasiado , es muy recargada , si me gusta lo que representa para la persona de la foto , me la imagino  feliz por su maternidad","Si , me gustan las fotos que retratan tradiciones","No , no me dice nada","Sí","","1 una tarde cualquiera de hace algunos años en cualquier pueblo  
2 una patata
3una escalera trasparente vista  desde abajo","4. Bastantes veces","4. Bastantes veces","4. Bastantes veces","4. Bastantes veces","4. Bastantes veces","4. Bastantes veces","Sí","Creo que son diferentes , no por el hecho de ser hombres o mujeres , sin porque cada persona a la hora de expresarse  lo hace con todas la vivencias  , por eso cada foto es parte uno mismo","4. NS / NC","No","","4649.55","73.24","","","","","378.53","","","","","","","","","","","734.13","","","","","","","","","","","","","","","","","","","","","","","","","","","","2891.25","","","","","","","","","","","","","","","","","","","","","","","","","","","","","","","","","","","","","","","","","","572.4","","","","","","","","","","",""
"650","2018-04-10 23:30:31","5","es","2018-04-10 22:45:05","2018-04-10 23:30:31","85.219.22.15","","Femenino","62","Española","Universitario graduado","3. Regular","Sí","No","","4. Diariamente","4. 2-4 horas","No","Sí","No","No","No","","4. Bastantes","1. Móvil","3. Casi todos los días","No","Sí","No","","3. Una vez a la semana","3. La mayor parte de las veces","45","Sí","3. En ocasiones","4. Bastantes veces","3. En ocasiones","3. A veces envío imágenes que hago yo y otras veces no, la proporción es equilibrada","Sí","1. No soy fan de nadie a quien admire","1. Nunca","4. Bastantes veces","3. En ocasiones","4. Bastantes veces","1. No accedo a la información propuesta","1. Busco imágenes para ilustrar lo que estoy diciendo.","2. Busco en Google Imágenes. Tengo en cuenta la licencia de la imagen que utilizo","1. Utilizo dispositivos para hacer una foto a lo que necesito (cámara de fotos, móvil, tablet, etc.)","","2. Una vez al mes","No","No","No","No","Sí","","No","No","No","No","No","No","","No","No","Sí","No","","2. Poco importante","No","Sí","No","No","No","","4. Bastantes veces","2. Casi todo por medios digitales","","La cola de un animal","Las piernas de una mujer","Una pareja en un caballo","Dos piernas de persona y seis patas de animal","Un ave","Un brazo con mano y la silueta de una cara","Una boca","Sombrillas cerradas","Persona y peces","Una mujer de espaldas","Hombres y melones","Sí","La sombra","La trenza de pelo","La posición de la gente","La violencia","Una persona y el mar","Un hombre orando","Dos peces un hombre y un barco","Una cortina y un hombre","Una pared con roto","Un hombre en un pie","Cuernos","2/2","2/2","1/2","1/2","Camino largo","Pueblo","Años antiguos","Relax","Sí","No","No","Estilos distintos","No. Porque veo destrucción","No. Veo tristeza","Si. Tiene mucho color","No. Veo confusión","Si. Hay contraste de color","Sí","","Conversación rutinas, embrión patatas y personas en pasarela","4. Bastantes veces","4. Bastantes veces","4. Bastantes veces","4. Bastantes veces","2. Muy pocas veces","4. Bastantes veces","No","","1. Más mujeres que hombres","No","","2045.58","66","","","","","172.62","","","","","","","","","","","524.45","","","","","","","","","","","","","","","","","","","","","","","","","","","","1154.93","","","","","","","","","","","","","","","","","","","","","","","","","","","","","","","","","","","","","","","","","","127.58","","","","","","","","","","",""
"652","2018-04-10 23:30:42","5","es","2018-04-10 22:46:17","2018-04-10 23:30:42","193.152.41.233","","Femenino","43","Española","Universitario graduado","5. Muy bueno","No","No","","5. Varias veces al día","4. 2-4 horas","No","Sí","Sí","Sí","Sí","app educativas","4. Bastantes","1. Móvil","4. A diario","Sí","Sí","No","","4. Dos o tres veces por semana","3. La mayor parte de las veces","2","Sí","4. Bastantes veces","4. Bastantes veces","3. En ocasiones","4. Muchas veces envío imágenes que hago yo","No","1. No soy fan de nadie a quien admire","1. Nunca","2. Muy pocas veces","3. En ocasiones","4. Bastantes veces","1. No accedo a la información propuesta","1. Busco imágenes para ilustrar lo que estoy diciendo.","1. Busco en Google Imágenes. No tengo en cuenta la licencia de la imagen que utilizo","1. Utilizo dispositivos para hacer una foto a lo que necesito (cámara de fotos, móvil, tablet, etc.)","","4. Dos o tres veces por semana","No","No","Sí","Sí","Sí","","No","No","No","No","No","No","","No","Sí","No","Sí","","1. Nada importante","Sí","Sí","Sí","No","No","","4. Bastantes veces","2. Casi todo por medios digitales","","Rocas en una playa","Una persona de espalda con un traje de chaqueta y unas piernas q salen entre sus piernas.","Una mujer vestida de flamenca sobre un caballo","Un perro unas piernas humanas y unas patas de caballo.","Un gallo de pelea","Una cara de susto y una mano alzada.","Una flor y unos labios.","Tres capas.","Un buzo y unos peces","Una mujer de espaldas a la cámara y su pelo parece la barba del hombre q está detrás.","Un vendedor de sandias q lanza las sandias al aire y parecen los pechos de la mujer.","Sí","No se refleja la torre","La pierna izda parece muy larga.","El niño vestido de blanco"," La euforia de la gente","Un balcón q da al mar.","Un hombre paseando por  una mezquita.","Un pescador transportando un pez","Un hombre leyendo un mapa con un pañuelo en la cabeza.","Unos ladrillos colocados con posterioridad.","Un hombre descansando sobre una estatua de unos pies.","Bufalos pastando.","1/2","1/2","1/2","1/2","Falta de libertad.","Tristeza","Melancolía.","Calma","Sí","No","Sí","El colorido va disminuyendo en las fotos.","No, porque hay escombros.","No hay un muro destruido detras y las personaa van ocultas tras esos capirotes.","Sí , por el.colorido y los bebés.","No, el tema de la foto no es de mi interes.","No, no me parece divertida.","Sí","","Unos ancianos conversando, las raíces de una patata y la vista debajo de un puente de cristal.","3. En ocasiones","3. En ocasiones","3. En ocasiones","4. Bastantes veces","3. En ocasiones","4. Bastantes veces","Sí","La temática , la intensidad en las emociones transmitidas.","1. Más mujeres que hombres","No","","2664.74","34.78","","","","","216.45","","","","","","","","","","","444.77","","","","","","","","","","","","","","","","","","","","","","","","","","","","1847.62","","","","","","","","","","","","","","","","","","","","","","","","","","","","","","","","","","","","","","","","","","121.12","","","","","","","","","","",""
"659","2018-04-11 00:38:19","5","es","2018-04-10 23:54:33","2018-04-11 00:38:19","77.208.112.185","","Femenino","39","Española","Universitario graduado","4. Bueno","Sí","No","","5. Varias veces al día","6. Más de 6 horas","No","Sí","Sí","Sí","Sí","","4. Bastantes","1. Móvil","4. A diario","No","Sí","No","","4. Dos o tres veces por semana","1. Nunca","1","Sí","3. En ocasiones","3. En ocasiones","2. Muy pocas veces","4. Muchas veces envío imágenes que hago yo","Sí","1. No soy fan de nadie a quien admire","1. Nunca","2. Muy pocas veces","3. En ocasiones","3. En ocasiones","1. No accedo a la información propuesta","1. Busco imágenes para ilustrar lo que estoy diciendo.","2. Busco en Google Imágenes. Tengo en cuenta la licencia de la imagen que utilizo","3. Utilizo ambas opciones combinadas","","2. Una vez al mes","Sí","No","No","No","Sí","","No","No","No","No","No","No","","No","No","No","No","Solo comparto con mi familia, para que sepan ómo estamos","1. Nada importante","No","Sí","No","No","No","","3. En ocasiones","2. Casi todo por medios digitales","","Una especie de globo o almohada en el borde de un pozo de piedra","Un hombre con traje de cuadros de pie frente a una mujer sentada con las piernas cruzadas","Una pareja con traje típico andaluz montando a caballo en una fiesta como la Feria de Abril o alguna romería andaluza","Un primer plano de las patas delanteras de un caballo, junto a las piernas de una mujer con botas altas que sujeta por la correa a un perro de pequeño tamaño con gorro y abrigo","Una pelea de gallos, una imagen con movimiento","Un brazo levantado en blanco y una silueta de una cara gritando en negro","El brote de una flor roja que se asemeja a unos labios que soplan suavemente ","Hábitos de tres monjas de espaldas, forma de prisma","Un nadador buceando rodeado de peces , formas triangulares","Un hombre frente a mi que abraza aún así mujer que queda de espaldas al fotógrafo ","Varias personas en una barca, una de ellas lanzando lo que parecen dos sandias.","Sí","La silueta del hombre y su sombra ","La pose forzada en equilibrio con las piernas","Las nubes de tormenta","El trozo de muro que va a golpear ","La silueta de un hombre tras un cristal semi-opaco.el hombre estaà observando el mar desde una terraza","Una puerta ( el hueco, no hay puerta propiamente dicha) que separa Dos estancias en un palacio arabe.","Un pez junto a un dibujo de un pez en el casco de un barco","Un hombre leyendo el periódico junto. Un balcón ","Ladrillos manchados de blanco","Un hombre sentado a los pies de una estatua gigante de buda","Bueyes pastando ","2/2","1/2","2/2","1/2","CALma, aire puro.","Frío, silencio","Calor","Naturaleza, frescor, sonido de pájaros ","Sí","No","Sí","figuras imples y otras recargadas. Las imágenes del arcén s dc","Si
Me gusta el edificio y el puente ","No, los capirotes e sresuktan desagradable","Si, por el color y la floressi","Si, por los juegos entre realidad y mitad elmrodajeno","No, me da sensación de que se está Ensuciando","Sí","","Unas niñas jugando mientras dos mujeres avanzadas en edad charlan en un banco Cerca de una iglesia
Los rizomas de una patata
La escalera de un lugar público Colón un instituto vista desde abajo","2. Muy pocas veces","2. Muy pocas veces","3. En ocasiones","3. En ocasiones","4. Bastantes veces","4. Bastantes veces","No","","3. Los dos por igual","No","","2628.3","44.31","","","","","99.4","","","","","","","","","","","314.16","","","","","","","","","","","","","","","","","","","","","","","","","","","","2089.09","","","","","","","","","","","","","","","","","","","","","","","","","","","","","","","","","","","","","","","","","","81.34","","","","","","","","","","",""
"662","2018-04-11 00:32:14","5","es","2018-04-11 00:16:30","2018-04-11 00:32:14","83.34.232.134","","Masculino","42","Español","Universitario graduado","3. Regular","Sí","No","","5. Varias veces al día","4. 2-4 horas","No","Sí","Sí","Sí","Sí","","4. Bastantes","2. Televisión","4. A diario","No","Sí","Sí","","3. Una vez a la semana","2. Alguna vez","2","Sí","3. En ocasiones","4. Bastantes veces","4. Bastantes veces","3. A veces envío imágenes que hago yo y otras veces no, la proporción es equilibrada","NS/NC","1. No soy fan de nadie a quien admire","3. En ocasiones","1. Nunca","3. En ocasiones","4. Bastantes veces","1. No accedo a la información propuesta","1. Busco imágenes para ilustrar lo que estoy diciendo.","1. Busco en Google Imágenes. No tengo en cuenta la licencia de la imagen que utilizo","2. Las compongo en programas de edición de imágenes desde otras fotografías","","4. Dos o tres veces por semana","Sí","No","No","No","Sí","","No","No","No","No","No","No","","No","Sí","Sí","No","","1. Nada importante","Sí","No","Sí","No","No","","3. En ocasiones","2. Casi todo por medios digitales","","Una persona desnuda tumbada sobre piedras","Una persona de pie, con las piernas de una mujer entre las suyas","Un hombre y una mujer, con el traje típico de Sevilla, a lomos de un caballo","una persona entre un perro y las patas de otro animal","Una pelea de gallos","En blanco, una mano y un brazo; en negro el perfil de una persona","Unos labios y una flor","Tres sombrillas cerradas","Un buzo y varios peces","Un hombre con una mujer, de pelo largo y rubio, delante","Unos hombres arrojando sandías","Sí","La persona que camina sobre el hielo","El equilibrio de la mujer","El conjunto costumbrista que forma","El momento histórico en que fue tomada la imagen","Una persona tras un cristal traslúcido","una persona al fondo, enmarcada por un arco","Un hombre cargando un atún","Una persona tras el nudo de una cortina","Ladrillos","Un hombre sentado sobre los pies de una estatua","Varios animales","2/2","2/2","2/2","1/2","Un largo camino, melancolía","Soledad","Tradición","Tranquilidad","Sí","Sí","Sí","No tienen nada que ver unas con otras","No","Sí","No","No","No","Sí","","1. Varias mujeres conversando y niñas jugando ante la Catedral de Salamanca
2. Una patata
3. Personas caminando sobre un suelo traslúcido
","3. En ocasiones","3. En ocasiones","2. Muy pocas veces","3. En ocasiones","3. En ocasiones","4. Bastantes veces","No","","4. NS / NC","No","","945.98","17.51","","","","","67.27","","","","","","","","","","","224.18","","","","","","","","","","","","","","","","","","","","","","","","","","","","579.45","","","","","","","","","","","","","","","","","","","","","","","","","","","","","","","","","","","","","","","","","","57.57","","","","","","","","","","",""
"669","2018-04-11 09:54:33","5","es","2018-04-11 09:16:55","2018-04-11 09:54:33","81.45.65.54","","Femenino","46","Española","Universitario graduado","4. Bueno","Sí","No","","5. Varias veces al día","2. Menos de una hora","No","Sí","No","Sí","No","","2. Pocas","1. Móvil","3. Casi todos los días","No","Sí","No","","4. Dos o tres veces por semana","2. Alguna vez","2","Sí","5. Casi siempre o siempre","3. En ocasiones","3. En ocasiones","3. A veces envío imágenes que hago yo y otras veces no, la proporción es equilibrada","No","1. No soy fan de nadie a quien admire","2. Muy pocas veces","3. En ocasiones","1. Nunca","5. Casi siempre o siempre","1. No accedo a la información propuesta","1. Busco imágenes para ilustrar lo que estoy diciendo.","2. Busco en Google Imágenes. Tengo en cuenta la licencia de la imagen que utilizo","1. Utilizo dispositivos para hacer una foto a lo que necesito (cámara de fotos, móvil, tablet, etc.)","","4. Dos o tres veces por semana","No","No","No","Sí","Sí","","No","No","No","No","No","No","","No","Sí","Sí","No","","1. Nada importante","Sí","Sí","No","No","No","","4. Bastantes veces","2. Casi todo por medios digitales","","?","Una pareja","La feria de abril de Sevilla","Perdona y perros","Un gallo","Una mano y una cara","Hojas","Capas","Peces y buceador","Una pareja","Personas y sandías","Sí","El salto sobre el agua","El movimiento","La separación por géneros","El sentimiento colectivo","La profundidad","Persona de cultura islámica","Pesca de atún","Persona enredada en una cortina","Muro","Persona con estatua gigante","Vacas","2/2","2/2","2/2","2/2","Profundidad","Soledad","Ansiedad","Sosiego","No","No","Sí","Líneas, colores y emociones","Sí. Refleja profundidad histórica","Sí. Sentimiento","Sí. Maternidad","Sí. Fiestas patronales","Sí. Graciosa","Sí","","Niñas y ancianas. Patata nacida.  Pasarela transparente","5. Casi siempre o siempre","3. En ocasiones","3. En ocasiones","4. Bastantes veces","4. Bastantes veces","5. Casi siempre o siempre","No","","1. Más mujeres que hombres","No","","2258.64","54.99","","","","","157.17","","","","","","","","","","","455.76","","","","","","","","","","","","","","","","","","","","","","","","","","","","1472.38","","","","","","","","","","","","","","","","","","","","","","","","","","","","","","","","","","","","","","","","","","118.34","","","","","","","","","","",""
"691","2018-04-11 17:45:55","5","es","2018-04-11 17:16:49","2018-04-11 17:45:55","79.145.18.65","","Femenino","55","Española","Universitario graduado","3. Regular","Sí","Sí","Presbicia","5. Varias veces al día","6. Más de 6 horas","No","Sí","No","Sí","No","Apps de lectura","3. Ni muchas ni pocas","3. Ordenador","3. Casi todos los días","No","Sí","Sí","","3. Una vez a la semana","2. Alguna vez","10","Sí","3. En ocasiones","1. Nunca","3. En ocasiones","3. A veces envío imágenes que hago yo y otras veces no, la proporción es equilibrada","Sí","1. No soy fan de nadie a quien admire","3. En ocasiones","2. Muy pocas veces","4. Bastantes veces","4. Bastantes veces","2. Accedo a la información propuesta","1. Busco imágenes para ilustrar lo que estoy diciendo.","2. Busco en Google Imágenes. Tengo en cuenta la licencia de la imagen que utilizo","1. Utilizo dispositivos para hacer una foto a lo que necesito (cámara de fotos, móvil, tablet, etc.)","","4. Dos o tres veces por semana","Sí","No","No","Sí","No","","No","No","No","No","No","No","","No","No","Sí","No","","1. Nada importante","Sí","No","No","No","No","","4. Bastantes veces","2. Casi todo por medios digitales","","Una mujer desnuda tumbada en una playa","Una mujer sentada en una silla con las piernas cruzadas y un hombre de espaldas ","Una mujer y un hombre montados a caballo","Un hombre con dos perros, uno pequeño y el otro de gran tamaño (solo se ven las patas)","Dos gallos peleándose","Una figura con la boca abierta","Labios","Triángulo","Cruz","Retángulo","Círculos","Sí","La sombra en el agua","La posición de la mujer","El niño vestido de blanco","El martillo","Figura humana en un balcón","Una persona (árabe por la vestimenta) paseando por una ciudad también árabe","Pescador cargando con un bonito","Hombre con un periódico en la mano","Muro restaurado","Hombre sentado en los dedos de una escultura gigante","Manada de animales, parecen búfalos","1/2","2/2","2/2","2/2","Simetría","Soledad","Tranquilidad","Paz","Sí","No","No","La primera predomina las líneas rectas y los colores planos. En la segunda predominan las las curvas y los tonos ocres y en la tercera predomina la curva y los tonos grises","Sí. Por el recuerdo de tiempos pasados y por estar en blanco y negro","No. No me gustan las manifestaciones religiosas de Semana Santa","No. No me interesa la vida privada de los personajes famososo","No. No sabría decir el motivo","No me resulta atractiva pero sí divertida","Sí","","Niñas jugando y ancianas hablando en la Plaza de Anaya de Salamanca
Patata con raices
Niños andando sobre una plataforma transparente","2. Muy pocas veces","2. Muy pocas veces","1. Nunca","4. Bastantes veces","4. Bastantes veces","3. En ocasiones","No","","2. Más hombres que mujeres.","No","","1746.53","19.32","","","","","111.74","","","","","","","","","","","227.12","","","","","","","","","","","","","","","","","","","","","","","","","","","","971.38","","","","","","","","","","","","","","","","","","","","","","","","","","","","","","","","","","","","","","","","","","416.97","","","","","","","","","","",""
"698","2018-04-11 20:26:33","5","es","2018-04-11 19:46:14","2018-04-11 20:26:33","2.154.114.129","https://l.facebook.com/","Femenino","21","rusa","Universitario sin graduar","3. Regular","No","No","","5. Varias veces al día","6. Más de 6 horas","Sí","Sí","Sí","Sí","Sí","","3. Ni muchas ni pocas","3. Ordenador","4. A diario","No","Sí","No","","4. Dos o tres veces por semana","3. La mayor parte de las veces","5","Sí","5. Casi siempre o siempre","1. Nunca","5. Casi siempre o siempre","5. Siempre mando imágenes que hago yo","NS/NC","1. No soy fan de nadie a quien admire","1. Nunca","1. Nunca","2. Muy pocas veces","3. En ocasiones","2. Accedo a la información propuesta","1. Busco imágenes para ilustrar lo que estoy diciendo.","1. Busco en Google Imágenes. No tengo en cuenta la licencia de la imagen que utilizo","","","5. A diario","No","No","Sí","No","Sí","","No","No","No","No","No","No","","No","No","Sí","No","","3. Neutral","Sí","Sí","No","No","No","","5. Casi siempre o siempre","2. Casi todo por medios digitales","","Una mujer tumbada en una playa de roca. A la izquierda, una pared de rocas; a la derecha se ve un trozo de la playa de roca; en el medio, los glúteos, la espalda y el pelo negro de la mujer","Una mujer sentada  y un hombre delante de ella. Está claro que tienen una relación con mucha confianza, pero no se trata del sexo oral (deducido de la posición de las piernas de la mujer)","Una mujer de piel bastante oscura, que lleva un vestido de sevillana, y un hombre encima de un caballo tordo","Las piernas de una mujer en botas altas con dos perros: uno grande y el otro pequeño","Una pelea de gallos","Un brazo levantado","Dos hojas pintadas para parecer labios","Conos (parasoles cerrados)","La recta formada por los brazos. Parece que el humano tiene la cabeza de un pez","Una mezcla de mujer y hombre","Las dos sandías se asemejan a los pechos de la mujer","Sí","El hombre a la parte derecha de la imagen que pretende correr por el agua o que se ha caído de la escalera","La cuerda","La sensación de tristeza que produce","La forma semicircular de la parte superior de la pared (por encima de la grieta)","Una persona contemplando el mar (u otro tipo de depósito de agua) en un balcón","Una persona a través de un arco","Una persona que lleva un pez en un puerto","Una persona con un trozo de papel (posiblemente un mapa). La cara de la persona está tapada por la cortina","Un cartel por encima del que se pintaron ladrillos","Una persona sentada en el pie de una estatua","Toros (u otros animales con cuernos) comiendo","1/2","1/2","2/2","2/2","paz y tranquilidad","tranquilidad, soledad","el paso del tiempo","tranquilidad, el sentimiento agradable cuando el sol de primavera te da en la cara","Sí","Sí","Sí","En la primera imagen las formas y los colores son más sencillos, mientras que en las últimas dos son más complejos (en la segunda más que en la tercera)","No porque no hay ningún detalle que me llame especialmente la atención","No porque invoca un pensamiento sobre el KKK (aunque me imagino que no son ellos)","No porque tiene demasiados colores vivos","No porque parece artificial, las personas parecen maniquíes ","Sí porque tiene una combinación de color curiosa e invoca emociones positivas","Sí","","1. Dos abuelas y dos niñas en un banco enfrente de la Catedral de Salamanca
2. Una patata con raíces
3. Gente bajando por una escalera de cristal semitransparente ","3. En ocasiones","5. Casi siempre o siempre","1. Nunca","4. Bastantes veces","5. Casi siempre o siempre","3. En ocasiones","Sí","No es diferencia entre las imágenes producidas por hombres y las que hacen mujeres, sino que cada persona percibe el mundo de manera distinta y, por tanto, hace fotos distintas.
En la primera foto se muestran los sentimientos, las emociones: el valor para luchar, la determinación
En la segunda foto se muestra que hay muchas personas que apoyan la huelga","3. Los dos por igual","Sí","Kerstin Langenberger y sus fotos de osos polares","2418.69","23.95","","","","","94.67","","","","","","","","","","","307.61","","","","","","","","","","","","","","","","","","","","","","","","","","","","1624.81","","","","","","","","","","","","","","","","","","","","","","","","","","","","","","","","","","","","","","","","","","367.65","","","","","","","","","","",""
