"236","2018-03-21 14:21:53","5","es","2018-03-21 13:55:59","2018-03-21 14:21:53","77.231.177.145","","Masculino","15","españa","Sin terminar Educación Secundaria Obligatoria","4. Bueno","Sí","No","","5. Varias veces al día","4. 2-4 horas","No","Sí","No","Sí","Sí","","5. Recibo y envio imágenes de forma constante","2. Televisión","4. A diario","No","Sí","No","","3. Una vez a la semana","2. Alguna vez","10","No","2. Muy pocas veces","1. Nunca","3. En ocasiones","3. A veces envío imágenes que hago yo y otras veces no, la proporción es equilibrada","Sí","2. Soy fan, pero no interactúas con sus publicaciones","3. En ocasiones","1. Nunca","4. Bastantes veces","2. Muy pocas veces","1. No accedo a la información propuesta","1. Busco imágenes para ilustrar lo que estoy diciendo.","1. Busco en Google Imágenes. No tengo en cuenta la licencia de la imagen que utilizo","","","5. A diario","No","No","No","No","Sí","","No","No","No","No","No","No","","No","Sí","No","No","","1. Nada importante","Sí","Sí","Sí","No","No","","5. Casi siempre o siempre","1. Todo de medios digitales","","una mujer desnuda tumbada a los pies de una montaña
","las piernas de una mujer entre las de un hombre","un hombre y una mujer montando a caballo","un hombre y sus dos perros","un gallo","una mano levantada","una rosa con forma de flor","tres monjas","un hombre buceando con peces a su  alrededor","una mujer de espaldas abrazando a un hombre","una frutería en china","Sí","la destruccion","la coleta","la tormenta","la destrucción del muro","la sombra de un hombre asomado a una barandilla","un hombre en un palacio","un pescador con un pez gigante","un hombre con una cortina enrollada en la cabeza","una pegatina desgastada en una pared","un hombre sentado en una escultura de un pie","unas vacas comiendo paja ","2/2","2/2","1/2","2/2","un camino infinito","que la vida es muy larga","la vida cotidiana","un barco navegando","Sí","Sí","Sí","que no son iguales","no","no","mucho","no","no","Sí","","la vida cotidiana y el paso del tiempo","3. En ocasiones","4. Bastantes veces","5. Casi siempre o siempre","5. Casi siempre o siempre","4. Bastantes veces","5. Casi siempre o siempre","No","","3. Los dos por igual","Sí","sr. plaza","1555.46","25.69","","","","","133.2","","","","","","","","","","","417.36","","","","","","","","","","","","","","","","","","","","","","","","","","","","914.98","","","","","","","","","","","","","","","","","","","","","","","","","","","","","","","","","","","","","","","","","","64.23","","","","","","","","","","",""
"237","2018-03-27 13:57:47","5","es","2018-03-21 13:56:05","2018-03-27 13:57:47","77.231.177.145","","Femenino","16","Española","Sin terminar Educación Secundaria Obligatoria","4. Bueno","Sí","No","","5. Varias veces al día","5. 4-6 horas","Sí","Sí","No","Sí","Sí","","3. Ni muchas ni pocas","1. Móvil","3. Casi todos los días","No","Sí","No","","3. Una vez a la semana","2. Alguna vez","3","Sí","3. En ocasiones","3. En ocasiones","3. En ocasiones","3. A veces envío imágenes que hago yo y otras veces no, la proporción es equilibrada","NS/NC","3. A veces interactúo con sus publicaciones en forma de like","2. Muy pocas veces","1. Nunca","2. Muy pocas veces","4. Bastantes veces","1. No accedo a la información propuesta","1. Busco imágenes para ilustrar lo que estoy diciendo.","2. Busco en Google Imágenes. Tengo en cuenta la licencia de la imagen que utilizo","","","2. Una vez al mes","No","No","Sí","No","No","","No","No","No","No","Sí","No","","Sí","No","No","No","","1. Nada importante","Sí","Sí","No","No","No","","3. En ocasiones","3. Por igual de medios digitales y analógicos","","yo veo una montaña en el fondo y como piedras en el suelo, pero no se que hay por el medio.","veo que hay un señor de espaldas y puesto levantado, mientras que hay una señora sentada cruzada de piernas detrás del hombre y por lo tanto solo se le ven las piernas a ella","veo a una sevillana y a un sevillano subidos en un caballo","veo que hay una persona con un perro pequeño y uno grande al cual solo se le ven las piernas","son al menos una gallina y otro animal que también tiene plumas","veo una cara de alguien con pelo largo y como gritando o bostezando; por otro lado si me fijo en el blanco más veo una brazo ","flor","unas sombrillas plegadas","pues un pez superpuesto a la cara de una persona buceando","esta un chico de frente a nosotros, como rodeando la cintura de la chica que esta de espaldas a nosotros ","pues unos asiáticos, y uno de ellos a lanzado dos melones al otro ","Sí","los relejos","la posición de la mujer","las nubes que están como de tormenta","creo que el muro y los grafitis","un balcón separado por un cristal translúcido que da al mar","pues como dos habitaciones separadas por una puerta con forma de arco","un hombre cargando con un pez","alguien que se ha en roscado la cortina en la cabeza y esta leyendo un periódico","ladrillos ","u hombre sentado en una estatua, concretamente en el pie ","toros o vacas","1/2","1/2","2/2","2/2","tranquilidad, algo infinito","tristeza","calor","calor, alegría, pimavera","Sí","Sí","No","1 coches 2 pintura 3 hueso","no no hay nada interesante","no","pues el colorido si pero es lo único que la hace atractiva","pues si, por la luz el polvo y el humo","pues si, no se es guay ","Sí","","pues en la primera imagen se ve a dos señoras mayores y a dos niñas sentadas pero a una de las niñas se la ve el culo porque esta agachada. en la segunda una semilla creciendo. y en la tercera  unas escaleras por abajo","3. En ocasiones","3. En ocasiones","3. En ocasiones","3. En ocasiones","3. En ocasiones","2. Muy pocas veces","No","","3. Los dos por igual","No","","2801.1","53.66","","","","","181.33","","","","","","","","","","","519.12","","","","","","","","","","","","","","","","","","","","","","","","","","","","1806.04","","","","","","","","","","","","","","","","","","","","","","","","","","","","","","","","","","","","","","","","","","240.95","","","","","","","","","","",""
"238","2018-03-21 14:30:22","5","es","2018-03-21 13:56:29","2018-03-21 14:30:22","77.231.177.145","","Masculino","15","España","Sin terminar Educación Secundaria Obligatoria","4. Bueno","Sí","No","","5. Varias veces al día","4. 2-4 horas","No","Sí","Sí","Sí","Sí","Videojuegos","4. Bastantes","3. Ordenador","4. A diario","No","Sí","No","","2. Una vez al mes","2. Alguna vez","5","Sí","3. En ocasiones","2. Muy pocas veces","3. En ocasiones","4. Muchas veces envío imágenes que hago yo","Sí","3. A veces interactúo con sus publicaciones en forma de like","3. En ocasiones","2. Muy pocas veces","4. Bastantes veces","4. Bastantes veces","1. No accedo a la información propuesta","1. Busco imágenes para ilustrar lo que estoy diciendo.","2. Busco en Google Imágenes. Tengo en cuenta la licencia de la imagen que utilizo","3. Utilizo ambas opciones combinadas","","5. A diario","No","No","Sí","No","Sí","","No","No","No","No","No","No","","No","No","Sí","Sí","","3. Neutral","Sí","Sí","No","No","No","","4. Bastantes veces","4. Casi todo de medios analógicos","","A una mujer tumbada en unas piedras","Las piernas de un hombre encima de las piernas de una mujer","Un hombre y una mujer encima de un caballo","Un perro grande, un perro pequeño y las piernas de un hombre","Un ave atacándose con otra","La forma de una mano y de un brazo","Unos flor con forma de labios","Tres túnicas de religiosas","Un hombre y peces en el mar","Un hombre y una mujer con pelo rubio","Unas sandías ","Sí","El hombre corriendo por el agua","La gran trenza que tiene","Nada","El hombre rompiendo una pared y saliendo agua de ella","Un hombre mirando al mar","Un arco con forma de cúpula y un hombre al final","Un barco con un atún dibujado y un hombre llevando un atún igual al del barco","Un hombre con una cortina atada a la cabeza","Un ladrillo con forma de pegatina, es una pegatina","Un hombre encima de unos dedos del pie gigantes de una escultura","Muchos animales con cuernos puntiagudos","1/2","2/2","1/2","1/2","Un camino con muchos árboles","Un hombre en una calle llena de casas","Una señora al lado de un edificio ","Un velero en un río","Sí","Sí","No","La primera es un coche mojado
La segunda  es el mar con sangre
Y la tercera es una almeja","Si debido a que hay una gran obra al final y antes de ella una calle con gente","No, porque son hombres de negro y dan un poco de miedo","Si porque hay una chica guapa con telas en su cuerpo","No, porque no la entiendo","No, porque es muy extraña","Sí","","En la primera unos ancianos y una niña
En la segunda una patata y sus raíces
Y en la tercera gente pasando por un puente transparente","4. Bastantes veces","3. En ocasiones","2. Muy pocas veces","3. En ocasiones","3. En ocasiones","2. Muy pocas veces","No","No encuentro ninguna","2. Más hombres que mujeres.","No","","2034.55","97.64","","","","","160.3","","","","","","","","","","","417.61","","","","","","","","","","","","","","","","","","","","","","","","","","","","1239.39","","","","","","","","","","","","","","","","","","","","","","","","","","","","","","","","","","","","","","","","","","119.61","","","","","","","","","","",""
"242","2018-03-21 14:28:02","5","es","2018-03-21 14:15:59","2018-03-21 14:28:02","77.231.177.145","","Femenino","17","españa","Sin terminar Educación Secundaria Obligatoria","2. Malo","Sí","No","","4. Diariamente","5. 4-6 horas","Sí","Sí","Sí","Sí","Sí","","5. Recibo y envio imágenes de forma constante","1. Móvil","4. A diario","No","Sí","No","","5. A diario","3. La mayor parte de las veces","15","Sí","4. Bastantes veces","4. Bastantes veces","4. Bastantes veces","3. A veces envío imágenes que hago yo y otras veces no, la proporción es equilibrada","Sí","3. A veces interactúo con sus publicaciones en forma de like","3. En ocasiones","2. Muy pocas veces","5. Casi siempre o siempre","5. Casi siempre o siempre","1. No accedo a la información propuesta","1. Busco imágenes para ilustrar lo que estoy diciendo.","1. Busco en Google Imágenes. No tengo en cuenta la licencia de la imagen que utilizo","1. Utilizo dispositivos para hacer una foto a lo que necesito (cámara de fotos, móvil, tablet, etc.)","","5. A diario","No","No","No","No","Sí","","No","No","No","No","No","No","","No","No","No","Sí","","3. Neutral","Sí","Sí","Sí","Sí","No","","3. En ocasiones","3. Por igual de medios digitales y analógicos","","señora desnuda en la playa","mamada","señores a caballo","dos perros y un señor","pelea de gallinas","un brazo y una señora abriendo la boca","labios","monjas","hombre buceando","pareja ","chicos pasandose sandias","Sí","el agua del suelo","la postura","rl niño","la gente","una mampara","sun señor andando tristw","un pez muy grande","ahorcado","ladrillos y un oso llorando","hombre sentado en una estatua","cabras","1/2","2/2","2/2","2/2","un camino largo por recorrer","u  hombre solo","una señora tiste y sola","suciedad","Sí","Sí","Sí","la primera es mas normal la segunada y la trercera son mas raras","si ","no porque me da miedo","sii ","si","sii","Sí","","dan miedo","3. En ocasiones","4. Bastantes veces","2. Muy pocas veces","3. En ocasiones","2. Muy pocas veces","4. Bastantes veces","No","","4. NS / NC","No","","725.75","22.67","","","","","60.01","","","","","","","","","","","180.79","","","","","","","","","","","","","","","","","","","","","","","","","","","","385.5","","","","","","","","","","","","","","","","","","","","","","","","","","","","","","","","","","","","","","","","","","76.78","","","","","","","","","","",""
"243","2018-03-21 15:16:24","5","es","2018-03-21 14:37:53","2018-03-21 15:16:24","92.177.137.53","https://limesurvey.grial.eu/index.php/219222?lang=es","Femenino","31","Española","Universitario graduado","4. Bueno","Sí","No","","5. Varias veces al día","5. 4-6 horas","Sí","Sí","Sí","Sí","Sí","","4. Bastantes","3. Ordenador","4. A diario","Sí","No","No","","4. Dos o tres veces por semana","2. Alguna vez","10","Sí","5. Casi siempre o siempre","4. Bastantes veces","3. En ocasiones","4. Muchas veces envío imágenes que hago yo","Sí","2. Soy fan, pero no interactúas con sus publicaciones","4. Bastantes veces","1. Nunca","3. En ocasiones","5. Casi siempre o siempre","1. No accedo a la información propuesta","2. Las genero yo","2. Busco en Google Imágenes. Tengo en cuenta la licencia de la imagen que utilizo","1. Utilizo dispositivos para hacer una foto a lo que necesito (cámara de fotos, móvil, tablet, etc.)","","4. Dos o tres veces por semana","Sí","No","Sí","No","No","","No","No","No","No","No","No","","No","Sí","No","Sí","","1. Nada importante","Sí","Sí","Sí","Sí","No","","5. Casi siempre o siempre","2. Casi todo por medios digitales","","sensualidad","invisibilización de la mujer","centauro ","una pandilla diferente","movimiento cruel","saludo","beso floral","los encapuchados","una nueva especie marina","los hipsters nos colonizan","casualidad","Sí","reflejo","la posición imposible","la separación de sexos","momento acertado y el valor informativo","una silueta","amarillo","un hombre pez","surrealismo","un remiendo","Un diminuto","uno mas en el hato","1/2","2/2","2/2","2/2","un túnel natural, lo desconocido.","soledad y alienación ","vejez, pausa, paciencia","belleza, libertad, naturaleza","Sí","Sí","Sí","En la primera el valor estético es cromático, la segunda es un valor abstracto, que sugiere a través de las formas y la luz y en la tercera veo un significado más simbólico.","si, me parece que puede tener un valor histórico y quiero saber más sobre ella.","Si, la tradición y el blanco y negro","no, no me gusta esta idealización burda.","si, es muy buena fotografía por el encuadre y además el humo sugiere algunas formas y esconde otras.","si, me parece graciosa","Sí","","La primera muestra las dos etapas más extremas de la vida, la infancia y la vejez. La segunda parece una patata araña enredada en su propia red. En la tercera me gusta el cambio de perspectiva.","5. Casi siempre o siempre","4. Bastantes veces","5. Casi siempre o siempre","5. Casi siempre o siempre","5. Casi siempre o siempre","5. Casi siempre o siempre","Sí","La imágenes realizadas por mujeres me parecen más intimistas, suelen ser mas cercanas al sujeto. Partimos de que su realidad es diferente por lo que la temática que suelen elegir también varía. ","2. Más hombres que mujeres.","Sí","Gervasio Sánchez","2311.38","26.76","","","","","135.65","","","","","","","","","","","438.48","","","","","","","","","","","","","","","","","","","","","","","","","","","","1410.93","","","","","","","","","","","","","","","","","","","","","","","","","","","","","","","","","","","","","","","","","","299.56","","","","","","","","","","",""
"253","2018-03-21 18:53:52","5","es","2018-03-21 18:27:30","2018-03-21 18:53:52","62.42.195.221","http://m.facebook.com","Femenino","35","Española","Universitario graduado","4. Bueno","Sí","No","","5. Varias veces al día","3. 1-2 horas","Sí","No","No","Sí","No","","2. Pocas","1. Móvil","4. A diario","No","Sí","No","","5. A diario","2. Alguna vez","2","Sí","4. Bastantes veces","4. Bastantes veces","3. En ocasiones","4. Muchas veces envío imágenes que hago yo","Sí","2. Soy fan, pero no interactúas con sus publicaciones","2. Muy pocas veces","1. Nunca","4. Bastantes veces","4. Bastantes veces","1. No accedo a la información propuesta","1. Busco imágenes para ilustrar lo que estoy diciendo.","1. Busco en Google Imágenes. No tengo en cuenta la licencia de la imagen que utilizo","1. Utilizo dispositivos para hacer una foto a lo que necesito (cámara de fotos, móvil, tablet, etc.)","","5. A diario","No","No","No","No","Sí","","No","No","No","No","No","No","","No","No","Sí","No","","1. Nada importante","Sí","Sí","No","No","No","","5. Casi siempre o siempre","2. Casi todo por medios digitales","","Una playa y una mujer","Un hombre y una mujer","Un jinete llevando una sevillana en caballo ","Dos perros y una persona","Pelea de gallos ","Una cara con la boca abierta y un brazo","Una flor con forma  de labios de persona ","3 sombrillas","Un buzo y peces","Un hombre y una mujer","Un señor tirándo dos melones ","Sí","La escalera flotante ","La postura de la mujer ","El cielo gris","Las personas que animan ","Un balcón y alguien detrás del cristal ","Un monje o algo asi","Un súper pescado ","Un hombre que una cortina le tapa la cabeza ","Una mancha ","Un hombre sentado en una escultura","Ñus","1/2","1/2","2/2","2/2","Un buen camino","Tristeza","Paseo","Paz","Sí","No","Sí","Los colores, las texturas y la luz","Por el fondo con el puente en construcción ","Por la luz","Por los colores tan llamativos","Por el momento de la tira del cohete ","Por el contraste","Sí","","Unas mujeres en Anaya 
Una patata
Gente bajando escaleras","4. Bastantes veces","4. Bastantes veces","4. Bastantes veces","4. Bastantes veces","4. Bastantes veces","4. Bastantes veces","No","","2. Más hombres que mujeres.","Sí","Alberto Prieto","1584.33","29.19","","","","","111.47","","","","","","","","","","","355.06","","","","","","","","","","","","","","","","","","","","","","","","","","","","993.74","","","","","","","","","","","","","","","","","","","","","","","","","","","","","","","","","","","","","","","","","","94.87","","","","","","","","","","",""
"254","2018-03-21 19:16:45","5","es","2018-03-21 18:50:58","2018-03-21 19:16:45","88.16.147.234","https://www.facebook.com/","Femenino","32","Española","FP","3. Regular","Sí","No","","5. Varias veces al día","4. 2-4 horas","Sí","Sí","No","Sí","Sí","","4. Bastantes","1. Móvil","3. Casi todos los días","Sí","Sí","No","","5. A diario","2. Alguna vez","60","Sí","4. Bastantes veces","3. En ocasiones","4. Bastantes veces","4. Muchas veces envío imágenes que hago yo","NS/NC","3. A veces interactúo con sus publicaciones en forma de like","4. Bastantes veces","2. Muy pocas veces","3. En ocasiones","5. Casi siempre o siempre","1. No accedo a la información propuesta","2. Las genero yo","3. Busco en web especializadas en imágenes. Conozco y uso contenidos con licencias","1. Utilizo dispositivos para hacer una foto a lo que necesito (cámara de fotos, móvil, tablet, etc.)","","4. Dos o tres veces por semana","No","No","No","No","Sí","","No","No","No","No","No","No","","No","No","Sí","No","","1. Nada importante","Sí","Sí","No","No","No","","4. Bastantes veces","2. Casi todo por medios digitales","","Una persona tumbada boca arriba sobre una playa de piedras mirando hacia un acantilado","una mujer sentada con las piernas cruzadas y un hombre de pie con las piernas abiertas de tal forma que las piernas de ella pasan por debajo","una caballo por detrás con un hombre (de espaldas) con sombrero y una mujer (de lado) con un vestido de sevillanas cogiendose la falda","las patas delanteras de un perro muy grande, las piernas de una persona y un perro pequeño con abrigo y gorro","dos gallos peleando","un brazo
una cara gritando","labios carnosos","tres personas con capas
tres sombrillas","un hombre buceando con peces
un hombre buceando con cabeza de pez","un hombre con una barba larga y rubia
un hombre ( de frente) y una mujer (de espaldas)","hombres pasándose melones
una mujer con dos melones como tetas","Sí","que hombre parece que levita","la postura de la mujer","nada","el corazón pintado en el muro","una persona apollada en una varandilla, difusa por un cristal que tiene al lado","una puerta y al fondo un hombre","un hombre llevando al hombro un pez muy grande","un hombre con la cortina (sin descolgar) atada a la cabeza ""leyendo"" un mapa","ladrillos","un hombre desde arriba dentado en una escultura de unos pies gigantes","toros comiendo","2/2","1/2","2/2","1/2","un pasadizo","soledad","pachorra","tranquilidad","Sí","No","No","todo","si","no","no","si. por la luz","si","Sí","","nose","3. En ocasiones","3. En ocasiones","4. Bastantes veces","3. En ocasiones","3. En ocasiones","2. Muy pocas veces","Sí","sólo hay un hombre, con lo cual la atención es toda para él, y el punto de vista lo hace más grande, más portento","3. Los dos por igual","Sí","Juán Rayos","1548.32","33.86","","","","","100.12","","","","","","","","","","","348.25","","","","","","","","","","","","","","","","","","","","","","","","","","","","927.15","","","","","","","","","","","","","","","","","","","","","","","","","","","","","","","","","","","","","","","","","","138.94","","","","","","","","","","",""
"257","2018-03-21 20:45:29","5","fr","2018-03-21 20:20:02","2018-03-21 20:45:29","78.251.212.11","http://m.facebook.com/","Masculino","23","Française ","Universitario graduado","4. Bueno","Sí","Sí","Astigmatisme","5. Varias veces al día","4. 2-4 horas","No","Sí","No","Sí","No","Traitement de texte","3. Ni muchas ni pocas","1. Móvil","2. Dos o tres veces por semana","No","Sí","No","","2. Una vez al mes","1. Nunca","5","Sí","2. Muy pocas veces","2. Muy pocas veces","2. Muy pocas veces","5. Siempre mando imágenes que hago yo","NS/NC","1. No soy fan de nadie a quien admire","4. Bastantes veces","1. Nunca","3. En ocasiones","4. Bastantes veces","1. No accedo a la información propuesta","1. Busco imágenes para ilustrar lo que estoy diciendo.","1. Busco en Google Imágenes. No tengo en cuenta la licencia de la imagen que utilizo","1. Utilizo dispositivos para hacer una foto a lo que necesito (cámara de fotos, móvil, tablet, etc.)","","2. Una vez al mes","No","No","Sí","No","Sí","","No","No","No","No","No","No","","No","No","No","Sí","Souvenirs","1. Nada importante","Sí","Sí","No","No","No","","5. Casi siempre o siempre","2. Casi todo por medios digitales","","Aucune information ne ressort de cette image","Des jambes de femme avec des chaussures ouvertes","Une femme sur un cheval, de derrière, la femme de profil. La scène a lieu dehors lors d'une feria. Des personnes au fond, avec un costume et des petites maisons","Des jambes d'homme, un chien et des jambes de cheval ","Bataille de coqs","Un bras et une main blanche sur fond noir
La main est levée et ouverte ","Une fleur rouge en forme de lèvres et des feuilles vertes en fond","Ce sont les parasols d'une terrasse","Un homme dans l'océan avec une tête de poisson","Un homme avec des cheveux blonds en guise de barbe ","Des pastèques, des personnes sur une barque ","Sí","Le décor sombre qui provoque une atmosphère pesante ","La position de la femme","La tristesse du moment avec les personnes assises","L'attitude de la foule derrière l'homme","Une personne qui regarde la mer sur un balcon","Un lieu avec des héritages arabes avec la forme de l'ouverture. Un lieu accueillant ","Un bateau, deux poissons ","Une personne qui lit le journal","Un mur","Une illusion d'optique. Un pied géant  (roches) et un homme mini dessus","Des cornes d'animaux ","2/2","2/2","2/2","2/2","Ouverture, l'infini, espace","Tristesse, pauvreté, angoisse","Le bonheur","Un endroit calme et paisible ","No","No","Sí","Les formes ne sont pas les mêmes ","Oui car elle mélange deux univers différents.","Non","Oui car elle met en scène une personne connue de presque tout le monde","Oui car elle joue sur les effets de lumière ","Oui grâce à l'humour ","NS/NC","","Des personnes descendant des escaliers sur la dernière photo","2. Muy pocas veces","2. Muy pocas veces","3. En ocasiones","3. En ocasiones","3. En ocasiones","3. En ocasiones","Sí","L'inégalité encore existe donne un pouvoir supplémentaire à celle des femmes","4. NS / NC","No","","1527.25","29.69","","","","","149.51","","","","","","","","","","","295.45","","","","","","","","","","","","","","","","","","","","","","","","","","","","956.84","","","","","","","","","","","","","","","","","","","","","","","","","","","","","","","","","","","","","","","","","","95.76","","","","","","","","","","",""
